[
  {
    "provider": "AWS",
    "instance_type": "p3.2xlarge",
    "instance_family": "P3",
    "year": 2017,
    "region": "us-east-1",
    "gpu_count": 1,
    "gpu_model": "V100",
    "gpu_memory_gb": 16,
    "vcpus": 8,
    "ram_gb": 61,
    "storage_gb": 0,
    "storage_type": "EBS",
    "network_bandwidth_gbps": 10.0,
    "gpu_interconnect": "NVLink",
    "gpu_interconnect_bandwidth_gbps": 300.0,
    "tflops_fp32": 15.7,
    "tflops_fp16": 125.0,
    "tflops_int8": 0.0,
    "tensor_cores": true,
    "price_ondemand_hourly": 3.06,
    "price_spot_hourly": 0.92,
    "price_1yr_reserved_hourly": 1.79,
    "price_3yr_reserved_hourly": 1.15,
    "ml_optimized": true,
    "inference_optimized": false,
    "training_optimized": true,
    "supports_multi_node": true,
    "storage_cost_per_gb_month": 0.10,
    "egress_cost_per_gb": 0.09,
    "availability": "GA",
    "notes": "First generation Volta-based ML instance"
  },
  {
    "provider": "AWS",
    "instance_type": "p3.8xlarge",
    "instance_family": "P3",
    "year": 2017,
    "region": "us-east-1",
    "gpu_count": 4,
    "gpu_model": "V100",
    "gpu_memory_gb": 16,
    "vcpus": 32,
    "ram_gb": 244,
    "storage_gb": 0,
    "storage_type": "EBS",
    "network_bandwidth_gbps": 10.0,
    "gpu_interconnect": "NVLink",
    "gpu_interconnect_bandwidth_gbps": 300.0,
    "tflops_fp32": 62.8,
    "tflops_fp16": 500.0,
    "tflops_int8": 0.0,
    "tensor_cores": true,
    "price_ondemand_hourly": 12.24,
    "price_spot_hourly": 3.67,
    "price_1yr_reserved_hourly": 7.15,
    "price_3yr_reserved_hourly": 4.61,
    "ml_optimized": true,
    "inference_optimized": false,
    "training_optimized": true,
    "supports_multi_node": true,
    "storage_cost_per_gb_month": 0.10,
    "egress_cost_per_gb": 0.09,
    "availability": "GA",
    "notes": "4x V100 for distributed training"
  },
  {
    "provider": "AWS",
    "instance_type": "p4d.24xlarge",
    "instance_family": "P4d",
    "year": 2020,
    "region": "us-east-1",
    "gpu_count": 8,
    "gpu_model": "A100",
    "gpu_memory_gb": 40,
    "vcpus": 96,
    "ram_gb": 1152,
    "storage_gb": 8000,
    "storage_type": "NVMe SSD",
    "network_bandwidth_gbps": 400.0,
    "gpu_interconnect": "NVSwitch",
    "gpu_interconnect_bandwidth_gbps": 600.0,
    "tflops_fp32": 156.0,
    "tflops_fp16": 2496.0,
    "tflops_int8": 4992.0,
    "tensor_cores": true,
    "price_ondemand_hourly": 32.77,
    "price_spot_hourly": 9.83,
    "price_1yr_reserved_hourly": 19.15,
    "price_3yr_reserved_hourly": 12.34,
    "ml_optimized": true,
    "inference_optimized": false,
    "training_optimized": true,
    "supports_multi_node": true,
    "storage_cost_per_gb_month": 0.10,
    "egress_cost_per_gb": 0.09,
    "availability": "GA",
    "notes": "8x A100 40GB with ultra-high bandwidth networking (312 TFLOPS FP16 per GPU)"
  },
  {
    "provider": "AWS",
    "instance_type": "p5.48xlarge",
    "instance_family": "P5",
    "year": 2023,
    "region": "us-east-1",
    "gpu_count": 8,
    "gpu_model": "H100",
    "gpu_memory_gb": 80,
    "vcpus": 192,
    "ram_gb": 2048,
    "storage_gb": 30000,
    "storage_type": "NVMe SSD",
    "network_bandwidth_gbps": 3200.0,
    "gpu_interconnect": "NVSwitch",
    "gpu_interconnect_bandwidth_gbps": 900.0,
    "tflops_fp32": 536.0,
    "tflops_fp16": 8000.0,
    "tflops_int8": 16000.0,
    "tensor_cores": true,
    "price_ondemand_hourly": 98.32,
    "price_spot_hourly": 29.50,
    "price_1yr_reserved_hourly": 57.45,
    "price_3yr_reserved_hourly": 37.02,
    "ml_optimized": true,
    "inference_optimized": false,
    "training_optimized": true,
    "supports_multi_node": true,
    "storage_cost_per_gb_month": 0.10,
    "egress_cost_per_gb": 0.09,
    "availability": "GA",
    "notes": "Latest generation with 8x H100 80GB SXM5 (1000 TFLOPS FP16 per GPU, dense)"
  },
  {
    "provider": "AWS",
    "instance_type": "g5.xlarge",
    "instance_family": "G5",
    "year": 2021,
    "region": "us-east-1",
    "gpu_count": 1,
    "gpu_model": "A10G",
    "gpu_memory_gb": 24,
    "vcpus": 4,
    "ram_gb": 16,
    "storage_gb": 0,
    "storage_type": "EBS",
    "network_bandwidth_gbps": 10.0,
    "gpu_interconnect": "",
    "gpu_interconnect_bandwidth_gbps": 0.0,
    "tflops_fp32": 31.2,
    "tflops_fp16": 125.0,
    "tflops_int8": 250.0,
    "tensor_cores": true,
    "price_ondemand_hourly": 1.006,
    "price_spot_hourly": 0.30,
    "price_1yr_reserved_hourly": 0.59,
    "price_3yr_reserved_hourly": 0.38,
    "ml_optimized": true,
    "inference_optimized": true,
    "training_optimized": false,
    "supports_multi_node": false,
    "storage_cost_per_gb_month": 0.10,
    "egress_cost_per_gb": 0.09,
    "availability": "GA",
    "notes": "Cost-effective inference instance"
  },
  {
    "provider": "AWS",
    "instance_type": "inf2.xlarge",
    "instance_family": "Inf2",
    "year": 2023,
    "region": "us-east-1",
    "gpu_count": 1,
    "gpu_model": "Inferentia2",
    "gpu_memory_gb": 32,
    "vcpus": 4,
    "ram_gb": 16,
    "storage_gb": 0,
    "storage_type": "EBS",
    "network_bandwidth_gbps": 15.0,
    "gpu_interconnect": "",
    "gpu_interconnect_bandwidth_gbps": 0.0,
    "tflops_fp32": 0.0,
    "tflops_fp16": 190.0,
    "tflops_int8": 380.0,
    "tensor_cores": false,
    "price_ondemand_hourly": 0.76,
    "price_spot_hourly": 0.23,
    "price_1yr_reserved_hourly": 0.44,
    "price_3yr_reserved_hourly": 0.28,
    "ml_optimized": true,
    "inference_optimized": true,
    "training_optimized": false,
    "supports_multi_node": false,
    "storage_cost_per_gb_month": 0.10,
    "egress_cost_per_gb": 0.09,
    "availability": "GA",
    "notes": "AWS custom inference chip"
  },
  {
    "provider": "Azure",
    "instance_type": "Standard_NC6s_v3",
    "instance_family": "NCv3",
    "year": 2018,
    "region": "eastus",
    "gpu_count": 1,
    "gpu_model": "V100",
    "gpu_memory_gb": 16,
    "vcpus": 6,
    "ram_gb": 112,
    "storage_gb": 736,
    "storage_type": "SSD",
    "network_bandwidth_gbps": 24.0,
    "gpu_interconnect": "NVLink",
    "gpu_interconnect_bandwidth_gbps": 300.0,
    "tflops_fp32": 15.7,
    "tflops_fp16": 125.0,
    "tflops_int8": 0.0,
    "tensor_cores": true,
    "price_ondemand_hourly": 3.06,
    "price_spot_hourly": 0.61,
    "price_1yr_reserved_hourly": 1.95,
    "price_3yr_reserved_hourly": 1.31,
    "ml_optimized": true,
    "inference_optimized": false,
    "training_optimized": true,
    "supports_multi_node": true,
    "storage_cost_per_gb_month": 0.12,
    "egress_cost_per_gb": 0.087,
    "availability": "GA",
    "notes": "Azure V100 instance"
  },
  {
    "provider": "Azure",
    "instance_type": "Standard_ND96asr_v4",
    "instance_family": "NDv4",
    "year": 2021,
    "region": "eastus",
    "gpu_count": 8,
    "gpu_model": "A100",
    "gpu_memory_gb": 40,
    "vcpus": 96,
    "ram_gb": 900,
    "storage_gb": 6000,
    "storage_type": "NVMe SSD",
    "network_bandwidth_gbps": 200.0,
    "gpu_interconnect": "NVLink",
    "gpu_interconnect_bandwidth_gbps": 600.0,
    "tflops_fp32": 156.0,
    "tflops_fp16": 2496.0,
    "tflops_int8": 4992.0,
    "tensor_cores": true,
    "price_ondemand_hourly": 27.20,
    "price_spot_hourly": 5.44,
    "price_1yr_reserved_hourly": 17.34,
    "price_3yr_reserved_hourly": 11.63,
    "ml_optimized": true,
    "inference_optimized": false,
    "training_optimized": true,
    "supports_multi_node": true,
    "storage_cost_per_gb_month": 0.12,
    "egress_cost_per_gb": 0.087,
    "availability": "GA",
    "notes": "8x A100 40GB with InfiniBand (312 TFLOPS FP16 per GPU)"
  },
  {
    "provider": "Azure",
    "instance_type": "Standard_ND96amsr_A100_v4",
    "instance_family": "ND A100 v4",
    "year": 2022,
    "region": "eastus",
    "gpu_count": 8,
    "gpu_model": "A100",
    "gpu_memory_gb": 80,
    "vcpus": 96,
    "ram_gb": 1900,
    "storage_gb": 6400,
    "storage_type": "NVMe SSD",
    "network_bandwidth_gbps": 200.0,
    "gpu_interconnect": "NVLink",
    "gpu_interconnect_bandwidth_gbps": 600.0,
    "tflops_fp32": 156.0,
    "tflops_fp16": 2496.0,
    "tflops_int8": 4992.0,
    "tensor_cores": true,
    "price_ondemand_hourly": 32.77,
    "price_spot_hourly": 6.55,
    "price_1yr_reserved_hourly": 20.89,
    "price_3yr_reserved_hourly": 14.01,
    "ml_optimized": true,
    "inference_optimized": false,
    "training_optimized": true,
    "supports_multi_node": true,
    "storage_cost_per_gb_month": 0.12,
    "egress_cost_per_gb": 0.087,
    "availability": "GA",
    "notes": "8x A100 80GB with double VRAM (312 TFLOPS FP16 per GPU)"
  },
  {
    "provider": "Azure",
    "instance_type": "Standard_NC4as_T4_v3",
    "instance_family": "NCasT4 v3",
    "year": 2020,
    "region": "eastus",
    "gpu_count": 1,
    "gpu_model": "T4",
    "gpu_memory_gb": 16,
    "vcpus": 4,
    "ram_gb": 28,
    "storage_gb": 180,
    "storage_type": "SSD",
    "network_bandwidth_gbps": 8.0,
    "gpu_interconnect": "",
    "gpu_interconnect_bandwidth_gbps": 0.0,
    "tflops_fp32": 8.1,
    "tflops_fp16": 65.0,
    "tflops_int8": 130.0,
    "tensor_cores": true,
    "price_ondemand_hourly": 0.526,
    "price_spot_hourly": 0.11,
    "price_1yr_reserved_hourly": 0.34,
    "price_3yr_reserved_hourly": 0.23,
    "ml_optimized": true,
    "inference_optimized": true,
    "training_optimized": false,
    "supports_multi_node": false,
    "storage_cost_per_gb_month": 0.12,
    "egress_cost_per_gb": 0.087,
    "availability": "GA",
    "notes": "Budget-friendly inference option"
  },
  {
    "provider": "GCP",
    "instance_type": "a2-highgpu-1g",
    "instance_family": "A2",
    "year": 2020,
    "region": "us-central1",
    "gpu_count": 1,
    "gpu_model": "A100",
    "gpu_memory_gb": 40,
    "vcpus": 12,
    "ram_gb": 85,
    "storage_gb": 0,
    "storage_type": "Persistent Disk",
    "network_bandwidth_gbps": 24.0,
    "gpu_interconnect": "NVLink",
    "gpu_interconnect_bandwidth_gbps": 600.0,
    "tflops_fp32": 19.5,
    "tflops_fp16": 39.0,